{
  "name": "source_backed_visible_food_eval",
  "version": 1,
  "description": "Public-source image examples for testing visible-food recognition. Expected labels are intentionally conservative; source URLs and direct image URLs come from Wikimedia Commons.",
  "source_policy": "Use for evaluation only; respect each image's linked license and attribution.",
  "examples": [
    {
      "id": "simple-apple",
      "source": "wikimedia_commons",
      "source_url": "https://commons.wikimedia.org/wiki/File:A_red_yellow_Apple.jpg",
      "image_url": "https://upload.wikimedia.org/wikipedia/commons/6/6c/A_red_yellow_Apple.jpg?utm_source=commons.wikimedia.org&utm_campaign=imageinfo&utm_content=original",
      "license": "CC BY-SA 4.0",
      "attribution": "<a href=\"//commons.wikimedia.org/w/index.php?title=User:Ucefkhc&amp;action=edit&amp;redlink=1\" class=\"new\" title=\"User:Ucefkhc (page does not exist)\">Youssef KH </a>",
      "source_title": "File:A red yellow Apple.jpg",
      "query": "red apple food photograph",
      "category": "simple_food",
      "expected_visible_ingredients": [
        {
          "name": "apple",
          "required": true,
          "source_backing": "seeded from source search query and Commons image result"
        }
      ],
      "ambiguous_visible_items": [],
      "forbidden_ingredients": [
        "banana",
        "granola"
      ],
      "notes": "Single whole fruit."
    },
    {
      "id": "simple-banana",
      "source": "wikimedia_commons",
      "source_url": "https://commons.wikimedia.org/wiki/File:Banana-Single.jpg",
      "image_url": "https://upload.wikimedia.org/wikipedia/commons/8/8a/Banana-Single.jpg?utm_source=commons.wikimedia.org&utm_campaign=imageinfo&utm_content=original",
      "license": "CC BY-SA 3.0",
      "attribution": "<a href=\"//commons.wikimedia.org/wiki/User:Evan-Amos\" title=\"User:Evan-Amos\">Evan-Amos</a>",
      "source_title": "File:Banana-Single.jpg",
      "query": "Banana-Single",
      "category": "simple_food",
      "expected_visible_ingredients": [
        {
          "name": "banana",
          "required": true,
          "source_backing": "seeded from source search query and Commons image result"
        }
      ],
      "ambiguous_visible_items": [],
      "forbidden_ingredients": [
        "granola",
        "strawberry"
      ],
      "notes": "Single fruit where banana is truly visible."
    },
    {
      "id": "simple-strawberries",
      "source": "wikimedia_commons",
      "source_url": "https://commons.wikimedia.org/wiki/File:Adriaen_Coorte_-_A_bowl_of_strawberries_and_a_spray_of_gooseberries.jpg",
      "image_url": "https://upload.wikimedia.org/wikipedia/commons/5/59/Adriaen_Coorte_-_A_bowl_of_strawberries_and_a_spray_of_gooseberries.jpg?utm_source=commons.wikimedia.org&utm_campaign=imageinfo&utm_content=original",
      "license": "Public domain",
      "attribution": "<bdi><a href=\"https://en.wikipedia.org/wiki/en:Adriaen_Coorte\" class=\"extiw\" title=\"w:en:Adriaen Coorte\"><span title=\"painter from the Northern Netherlands (1665-1707)\">Adriaen Coorte</span></a></bdi>",
      "source_title": "File:Adriaen Coorte - A bowl of strawberries and a spray of gooseberries.jpg",
      "query": "strawberries bowl photograph",
      "category": "simple_food",
      "expected_visible_ingredients": [
        {
          "name": "strawberries",
          "required": true,
          "source_backing": "seeded from source search query and Commons image result"
        }
      ],
      "ambiguous_visible_items": [],
      "forbidden_ingredients": [
        "banana",
        "granola"
      ],
      "notes": "Red berries should not imply toppings."
    },
    {
      "id": "simple-orange",
      "source": "wikimedia_commons",
      "source_url": "https://commons.wikimedia.org/wiki/File:Citrus_Elegance_Blood_Orange_Slices_in_Wooden_Nest_by_Raju_C_Reddy.jpg",
      "image_url": "https://upload.wikimedia.org/wikipedia/commons/a/a5/Citrus_Elegance_Blood_Orange_Slices_in_Wooden_Nest_by_Raju_C_Reddy.jpg?utm_source=commons.wikimedia.org&utm_campaign=imageinfo&utm_content=original",
      "license": "CC0",
      "attribution": "rajucreddy",
      "source_title": "File:Citrus Elegance Blood Orange Slices in Wooden Nest by Raju C Reddy.jpg",
      "query": "orange fruit slices photograph",
      "category": "simple_food",
      "expected_visible_ingredients": [
        {
          "name": "orange",
          "required": true,
          "source_backing": "seeded from source search query and Commons image result"
        }
      ],
      "ambiguous_visible_items": [],
      "forbidden_ingredients": [
        "banana",
        "granola"
      ],
      "notes": "Citrus slices."
    },
    {
      "id": "simple-avocado",
      "source": "wikimedia_commons",
      "source_url": "https://commons.wikimedia.org/wiki/File:Liat_Portal_for_Foodie_Disorder_-_Avocado_Halves.jpg",
      "image_url": "https://upload.wikimedia.org/wikipedia/commons/a/af/Liat_Portal_for_Foodie_Disorder_-_Avocado_Halves.jpg?utm_source=commons.wikimedia.org&utm_campaign=imageinfo&utm_content=original",
      "license": "CC BY-SA 4.0",
      "attribution": "<a href=\"//commons.wikimedia.org/w/index.php?title=User:HaJunkiyada&amp;action=edit&amp;redlink=1\" class=\"new\" title=\"User:HaJunkiyada (page does not exist)\">HaJunkiyada</a>",
      "source_title": "File:Liat Portal for Foodie Disorder - Avocado Halves.jpg",
      "query": "avocado halves photograph",
      "category": "simple_food",
      "expected_visible_ingredients": [
        {
          "name": "avocado",
          "required": true,
          "source_backing": "seeded from source search query and Commons image result"
        }
      ],
      "ambiguous_visible_items": [],
      "forbidden_ingredients": [
        "egg",
        "toast"
      ],
      "notes": "Plain avocado without toast assumptions."
    },
    {
      "id": "simple-fried-egg",
      "source": "wikimedia_commons",
      "source_url": "https://commons.wikimedia.org/wiki/File:02021_0912_(6)_Fried_egg_in_the_basket.jpg",
      "image_url": "https://upload.wikimedia.org/wikipedia/commons/d/d6/02021_0912_%286%29_Fried_egg_in_the_basket.jpg?utm_source=commons.wikimedia.org&utm_campaign=imageinfo&utm_content=original",
      "license": "CC BY-SA 4.0",
      "attribution": "<a href=\"//commons.wikimedia.org/w/index.php?title=User:Silar&amp;action=edit&amp;redlink=1\" class=\"new\" title=\"User:Silar (page does not exist)\">Silar</a>",
      "source_title": "File:02021 0912 (6) Fried egg in the basket.jpg",
      "query": "fried egg photograph",
      "category": "simple_food",
      "expected_visible_ingredients": [
        {
          "name": "egg",
          "required": true,
          "source_backing": "seeded from source search query and Commons image result"
        }
      ],
      "ambiguous_visible_items": [],
      "forbidden_ingredients": [
        "toast",
        "bacon"
      ],
      "notes": "Simple cooked egg."
    },
    {
      "id": "simple-boiled-eggs",
      "source": "wikimedia_commons",
      "source_url": "https://commons.wikimedia.org/wiki/File:Cod_liver,_hard-boiled_egg,_and_black_pepper_atop_lentils_cooked_with_goose_fat_-_Massachusetts.jpg",
      "image_url": "https://upload.wikimedia.org/wikipedia/commons/3/36/Cod_liver%2C_hard-boiled_egg%2C_and_black_pepper_atop_lentils_cooked_with_goose_fat_-_Massachusetts.jpg?utm_source=commons.wikimedia.org&utm_campaign=imageinfo&utm_content=original",
      "license": "CC0",
      "attribution": "<a href=\"//commons.wikimedia.org/wiki/User:Daderot\" title=\"User:Daderot\">Daderot</a>",
      "source_title": "File:Cod liver, hard-boiled egg, and black pepper atop lentils cooked with goose fat - Massachusetts.jpg",
      "query": "Eggs hard-boiled Massachusetts",
      "category": "simple_food",
      "expected_visible_ingredients": [
        {
          "name": "egg",
          "required": true,
          "source_backing": "seeded from source search query and Commons image result"
        }
      ],
      "ambiguous_visible_items": [],
      "forbidden_ingredients": [
        "mayonnaise",
        "toast"
      ],
      "notes": "Eggs only."
    },
    {
      "id": "simple-grilled-salmon",
      "source": "wikimedia_commons",
      "source_url": "https://commons.wikimedia.org/wiki/File:2022-01-29_20_53_20_Blackened_Cajun_Salmon_(6_oz._blackened_and_grilled_salmon_fillet_with_garlic_mashed_potatoes_and_steamed_broccoli)_at_the_Applebee%27s_in_Fair_Lakes,_Fairfax_County,_Virginia.jpg",
      "image_url": "https://upload.wikimedia.org/wikipedia/commons/2/24/2022-01-29_20_53_20_Blackened_Cajun_Salmon_%286_oz._blackened_and_grilled_salmon_fillet_with_garlic_mashed_potatoes_and_steamed_broccoli%29_at_the_Applebee%27s_in_Fair_Lakes%2C_Fairfax_County%2C_Virginia.jpg?utm_source=commons.wikimedia.org&utm_campaign=imageinfo&utm_content=original",
      "license": "CC BY-SA 4.0",
      "attribution": "<a href=\"//commons.wikimedia.org/wiki/User:Famartin\" title=\"User:Famartin\">Famartin</a>",
      "source_title": "File:2022-01-29 20 53 20 Blackened Cajun Salmon (6 oz. blackened and grilled salmon fillet with garlic mashed potatoes and steamed broccoli) at the Applebee's in Fair Lakes, Fairfax County, Virginia.jpg",
      "query": "grilled salmon fillet photograph",
      "category": "simple_food",
      "expected_visible_ingredients": [
        {
          "name": "salmon",
          "required": true,
          "source_backing": "seeded from source search query and Commons image result"
        }
      ],
      "ambiguous_visible_items": [],
      "forbidden_ingredients": [
        "rice",
        "potatoes"
      ],
      "notes": "Protein-only or primary protein image."
    },
    {
      "id": "simple-steak",
      "source": "wikimedia_commons",
      "source_url": "https://commons.wikimedia.org/wiki/File:Grilled_beef_steak_in_Cala_P%C3%AD,_Mallorca,_Spain.jpg",